id,sentence,file_name,location
198,"In the face of that young student who sleeps just three hours before working the night shift, I think about my mom, who raised my sister and me on her own while she worked and earned her degree; who once turned to food stamps but was still able to send us to the best schools in the country with the help of student loans and scholarships.",doc2.txt,65
199,"When I listen to another worker tell me that his factory has shut down, I remember all those men and women on the South Side of Chicago who I stood by and fought for two decades ago after the local steel plant closed.",doc2.txt,66
200,"And when I hear a woman talk about the difficulties of starting her own business, I think about my grandmother, who worked her way up from the secretarial pool to middle-management, despite years of being passed over for promotions because she was a woman.",doc2.txt,67
201,She's the one who taught me about hard work.,doc2.txt,68
202,She's the one who put off buying a new car or a new dress for herself so that I could have a better life.,doc2.txt,69
203,She poured everything she had into me.,doc2.txt,70
204,"And although she can no longer travel, I know that she's watching tonight, and that tonight is her night as well.",doc2.txt,71
205,"I don't know what kind of lives John McCain thinks that celebrities lead, but this has been mine.",doc2.txt,72
206,These are my heroes.,doc2.txt,73
207,Theirs are the stories that shaped me.,doc2.txt,74
208,And it is on their behalf that I intend to win this election and keep our promise alive as President of the United States.,doc2.txt,75
209,What is that promise?,doc2.txt,76
210,"It's a promise that says each of us has the freedom to make of our own lives what we will, but that we also have the obligation to treat each other with dignity and respect.",doc2.txt,77
211,"It's a promise that says the market should reward drive and innovation and generate growth, but that businesses should live up to their responsibilities to create American jobs, look out for American workers, and play by the rules of the road.",doc2.txt,78
212,"Ours is a promise that says government cannot solve all our problems, but what it should do is that which we cannot do for ourselves - protect us from harm and provide every child a decent education; keep our water clean and our toys safe; invest in new schools and new roads and new science and technology.",doc2.txt,79
213,"Our government should work for us, not against us.",doc2.txt,80
214,"It should help us, not hurt us.",doc2.txt,81
215,"It should ensure opportunity not just for those with the most money and influence, but for every American who's willing to work.",doc2.txt,82
216,"That's the promise of America - the idea that we are responsible for ourselves, but that we also rise or fall as one nation; the fundamental belief that I am my brother's keeper; I am my sister's keeper.",doc2.txt,83
217,That's the promise we need to keep.,doc2.txt,84
218,That's the change we need right now.,doc2.txt,85
219,So let me spell out exactly what that change would mean if I am President.,doc2.txt,86
220,"Change means a tax code that doesn't reward the lobbyists who wrote it, but the American workers and small businesses who deserve it.",doc2.txt,87
221,"Unlike John McCain, I will stop giving tax breaks to corporations that ship jobs overseas, and I will start giving them to companies that create good jobs right here in America.",doc2.txt,88
222,"I will eliminate capital gains taxes for the small businesses and the start-ups that will create the high-wage, high-tech jobs of tomorrow.",doc2.txt,89
223,I will cut taxes - cut taxes - for 95% of all working families.,doc2.txt,90
224,"Because in an economy like this, the last thing we should do is raise taxes on the middle-class.",doc2.txt,91
225,"And for the sake of our economy, our security, and the future of our planet, I will set a clear goal as President: in ten years, we will finally end our dependence on oil from the Middle East.",doc2.txt,92
226,"Washington's been talking about our oil addiction for the last thirty years, and John McCain has been there for twenty-six of them.",doc2.txt,93
227,"In that time, he's said no to higher fuel-efficiency standards for cars, no to investments in renewable energy, no to renewable fuels.",doc2.txt,94
228,"And today, we import triple the amount of oil as the day that Senator McCain took office.",doc2.txt,95
229,"Now is the time to end this addiction, and to understand that drilling is a stop-gap measure, not a long-term solution.",doc2.txt,96
230,Not even close.,doc2.txt,97
231,"As President, I will tap our natural gas reserves, invest in clean coal technology, and find ways to safely harness nuclear power.",doc2.txt,98
232,"I'll help our auto companies re-tool, so that the fuel-efficient cars of the future are built right here in America.",doc2.txt,99
233,I'll make it easier for the American people to afford these new cars.,doc2.txt,100
234,"And I'll invest 150 billion dollars over the next decade in affordable, renewable sources of energy - wind power and solar power and the next generation of biofuels; an investment that will lead to new industries and five million new jobs that pay well and can't ever be outsourced.",doc2.txt,101
235,"America, now is not the time for small plans.",doc2.txt,102
236,"Now is the time to finally meet our moral obligation to provide every child a world-class education, because it will take nothing less to compete in the global economy.",doc2.txt,103
237,Michelle and I are only here tonight because we were given a chance at an education.,doc2.txt,104
238,And I will not settle for an America where some kids don't have that chance.,doc2.txt,105
239,I'll invest in early childhood education.,doc2.txt,106
240,"I'll recruit an army of new teachers, and pay them higher salaries and give them more support.",doc2.txt,107
241,"And in exchange, I'll ask for higher standards and more accountability.",doc2.txt,108
242,"And we will keep our promise to every young American - if you commit to serving your community or your country, we will make sure you can afford a college education.",doc2.txt,109
243,"Now is the time to finally keep the promise of affordable, accessible health care for every single American.",doc2.txt,110
244,"If you have health care, my plan will lower your premiums.",doc2.txt,111
245,"If you don't, you'll be able to get the same kind of coverage that members of Congress give themselves.",doc2.txt,112
246,"And as someone who watched my mother argue with insurance companies while she lay in bed dying of cancer, I will make certain those companies stop discriminating against those who are sick and need care the most.",doc2.txt,113
247,"Now is the time to help families with paid sick days and better family leave, because nobody in America should have to choose between keeping their jobs and caring for a sick child or ailing parent.",doc2.txt,114
248,"Now is the time to change our bankruptcy laws, so that your pensions are protected ahead of CEO bonuses; and the time to protect Social Security for future generations.",doc2.txt,115
249,"And now is the time to keep the promise of equal pay for an equal day's work, because I want my daughters to have exactly the same opportunities as your sons.",doc2.txt,116
250,"Now, many of these plans will cost money, which is why I've laid out how I'll pay for every dime - by closing corporate loopholes and tax havens that don't help America grow.",doc2.txt,117
251,"But I will also go through the federal budget, line by line, eliminating programs that no longer work and making the ones we do need work better and cost less - because we cannot meet twenty-first century challenges with a twentieth century bureaucracy.",doc2.txt,118
252,"And Democrats, we must also admit that fulfilling America's promise will require more than just money.",doc2.txt,119
253,"It will require a renewed sense of responsibility from each of us to recover what John F. Kennedy called our ""intellectual and moral strength.""",doc2.txt,120
254,"Yes, government must lead on energy independence, but each of us must do our part to make our homes and businesses more efficient.",doc2.txt,121
255,"Yes, we must provide more ladders to success for young men who fall into lives of crime and despair.",doc2.txt,122
256,But we must also admit that programs alone can't replace parents; that government can't turn off the television and make a child do her homework; that fathers must take more responsibility for providing the love and guidance their children need.,doc2.txt,123
257,Individual responsibility and mutual responsibility - that's the essence of America's promise.,doc2.txt,124
258,"And just as we keep our keep our promise to the next generation here at home, so must we keep America's promise abroad.",doc2.txt,125
259,"If John McCain wants to have a debate about who has the temperament, and judgment, to serve as the next Commander-in-Chief, that's a debate I'm ready to have.",doc2.txt,126
260,"For while Senator McCain was turning his sights to Iraq just days after 9/11, I stood up and opposed this war, knowing that it would distract us from the real threats we face.",doc2.txt,127
261,"When John McCain said we could just ""muddle through"" in Afghanistan, I argued for more resources and more troops to finish the fight against the terrorists who actually attacked us on 9/11, and made clear that we must take out Osama bin Laden and his lieutenants if we have them in our sights.",doc2.txt,128
262,John McCain likes to say that he'll follow bin Laden to the Gates of Hell - but he won't even go to the cave where he lives.,doc2.txt,129
263,"And today, as my call for a time frame to remove our troops from Iraq has been echoed by the Iraqi government and even the Bush Administration, even after we learned that Iraq has a $79 billion surplus while we're wallowing in deficits, John McCain stands alone in his stubborn refusal to end a misguided war.",doc2.txt,130
264,That's not the judgment we need.,doc2.txt,131
265,That won't keep America safe.,doc2.txt,132
266,"We need a President who can face the threats of the future, not keep grasping at the ideas of the past.",doc2.txt,133
267,You don't defeat a terrorist network that operates in eighty countries by occupying Iraq.,doc2.txt,134
268,You don't protect Israel and deter Iran just by talking tough in Washington.,doc2.txt,135
269,You can't truly stand up for Georgia when you've strained our oldest alliances.,doc2.txt,136
270,"If John McCain wants to follow George Bush with more tough talk and bad strategy, that is his choice - but it is not the change we need.",doc2.txt,137
271,We are the party of Roosevelt.,doc2.txt,138
272,We are the party of Kennedy.,doc2.txt,139
273,So don't tell me that Democrats won't defend this country.,doc2.txt,140
274,Don't tell me that Democrats won't keep us safe.,doc2.txt,141
275,"The Bush-McCain foreign policy has squandered the legacy that generations of Americans -- Democrats and Republicans - have built, and we are here to restore that legacy.",doc2.txt,142
276,"As Commander-in-Chief, I will never hesitate to defend this nation, but I will only send our troops into harm's way with a clear mission and a sacred commitment to give them the equipment they need in battle and the care and benefits they deserve when they come home.",doc2.txt,143
277,"I will end this war in Iraq responsibly, and finish the fight against al Qaeda and the Taliban in Afghanistan.",doc2.txt,144
278,I will rebuild our military to meet future conflicts.,doc2.txt,145
279,"But I will also renew the tough, direct diplomacy that can prevent Iran from obtaining nuclear weapons and curb Russian aggression.",doc2.txt,146
280,I will build new partnerships to defeat the threats of the 21st century: terrorism and nuclear proliferation; poverty and genocide; climate change and disease.,doc2.txt,147
281,"And I will restore our moral standing, so that America is once again that last, best hope for all who are called to the cause of freedom, who long for lives of peace, and who yearn for a better future.",doc2.txt,148
282,These are the policies I will pursue.,doc2.txt,149
283,"And in the weeks ahead, I look forward to debating them with John McCain.",doc2.txt,150
284,But what I will not do is suggest that the Senator takes his positions for political purposes.,doc2.txt,151
285,Because one of the things that we have to change in our politics is the idea that people cannot disagree without challenging each other's character and patriotism.,doc2.txt,152
286,"The times are too serious, the stakes are too high for this same partisan playbook.",doc2.txt,153
287,So let us agree that patriotism has no party.,doc2.txt,154
288,"I love this country, and so do you, and so does John McCain.",doc2.txt,155
289,"The men and women who serve in our battlefields may be Democrats and Republicans and Independents, but they have fought together and bled together and some died together under the same proud flag.",doc2.txt,156
290,They have not served a Red America or a Blue America - they have served the United States of America.,doc2.txt,157
291,"So I've got news for you, John McCain.",doc2.txt,158
292,We all put our country first.,doc2.txt,159
293,"America, our work will not be easy.",doc2.txt,160
294,"The challenges we face require tough choices, and Democrats as well as Republicans will need to cast off the worn-out ideas and politics of the past.",doc2.txt,161
295,For part of what has been lost these past eight years can't just be measured by lost wages or bigger trade deficits.,doc2.txt,162
296,What has also been lost is our sense of common purpose - our sense of higher purpose.,doc2.txt,163
297,And that's what we have to restore.,doc2.txt,164
298,"We may not agree on abortion, but surely we can agree on reducing the number of unwanted pregnancies in this country.",doc2.txt,165
299,"The reality of gun ownership may be different for hunters in rural Ohio than for those plagued by gang-violence in Cleveland, but don't tell me we can't uphold the Second Amendment while keeping AK-47s out of the hands of criminals.",doc2.txt,166
300,"I know there are differences on same-sex marriage, but surely we can agree that our gay and lesbian brothers and sisters deserve to visit the person they love in the hospital and to live lives free of discrimination.",doc2.txt,167
301,"Passions fly on immigration, but I don't know anyone who benefits when a mother is separated from her infant child or an employer undercuts American wages by hiring illegal workers.",doc2.txt,168
302,This too is part of America's promise - the promise of a democracy where we can find the strength and grace to bridge divides and unite in common effort.,doc2.txt,169
303,I know there are those who dismiss such beliefs as happy talk.,doc2.txt,170
304,"They claim that our insistence on something larger, something firmer and more honest in our public life is just a Trojan Horse for higher taxes and the abandonment of traditional values.",doc2.txt,171
305,And that's to be expected.,doc2.txt,172
306,"Because if you don't have any fresh ideas, then you use stale tactics to scare the voters.",doc2.txt,173
307,"If you don't have a record to run on, then you paint your opponent as someone people should run from.",doc2.txt,174
308,You make a big election about small things.,doc2.txt,175
309,And you know what - it's worked before.,doc2.txt,176
310,Because it feeds into the cynicism we all have about government.,doc2.txt,177
311,"When Washington doesn't work, all its promises seem empty.",doc2.txt,178
312,"If your hopes have been dashed again and again, then it's best to stop hoping, and settle for what you already know.",doc2.txt,179
313,I get it.,doc2.txt,180
314,I realize that I am not the likeliest candidate for this office.,doc2.txt,181
315,"I don't fit the typical pedigree, and I haven't spent my career in the halls of Washington.",doc2.txt,182
316,But I stand before you tonight because all across America something is stirring.,doc2.txt,183
317,What the nay-sayers don't understand is that this election has never been about me.,doc2.txt,184
318,It's been about you.,doc2.txt,185
319,"For eighteen long months, you have stood up, one by one, and said enough to the politics of the past.",doc2.txt,186
320,"You understand that in this election, the greatest risk we can take is to try the same old politics with the same old players and expect a different result.",doc2.txt,187
321,"You have shown what history teaches us - that at defining moments like this one, the change we need doesn't come from Washington.",doc2.txt,188
322,Change comes to Washington.,doc2.txt,189
323,"Change happens because the American people demand it - because they rise up and insist on new ideas and new leadership, a new politics for a new time.",doc2.txt,190
324,"America, this is one of those moments.",doc2.txt,191
325,"I believe that as hard as it will be, the change we need is coming.",doc2.txt,192
326,Because I've seen it.,doc2.txt,193
327,Because I've lived it.,doc2.txt,194
328,"I've seen it in Illinois, when we provided health care to more children and moved more families from welfare to work.",doc2.txt,195
329,"I've seen it in Washington, when we worked across party lines to open up government and hold lobbyists more accountable, to give better care for our veterans and keep nuclear weapons out of terrorist hands.",doc2.txt,196
330,And I've seen it in this campaign.,doc2.txt,197
331,"In the young people who voted for the first time, and in those who got involved again after a very long time.",doc2.txt,198
332,"In the Republicans who never thought they'd pick up a Democratic ballot, but did.",doc2.txt,199
333,"I've seen it in the workers who would rather cut their hours back a day than see their friends lose their jobs, in the soldiers who re-enlist after losing a limb, in the good neighbors who take a stranger in when a hurricane strikes and the floodwaters rise.",doc2.txt,200
334,"This country of ours has more wealth than any nation, but that's not what makes us rich.",doc2.txt,201
335,"We have the most powerful military on Earth, but that's not what makes us strong.",doc2.txt,202
336,"Our universities and our culture are the envy of the world, but that's not what keeps the world coming to our shores.",doc2.txt,203
337,"Instead, it is that American spirit - that American promise - that pushes us forward even when the path is uncertain; that binds us together in spite of our differences; that makes us fix our eye not on what is seen, but what is unseen, that better place around the bend.",doc2.txt,204
338,That promise is our greatest inheritance.,doc2.txt,205
339,"It's a promise I make to my daughters when I tuck them in at night, and a promise that you make to yours - a promise that has led immigrants to cross oceans and pioneers to travel west; a promise that led workers to picket lines, and women to reach for the ballot.",doc2.txt,206
340,"And it is that promise that forty five years ago today, brought Americans from every corner of this land to stand together on a Mall in Washington, before Lincoln's Memorial, and hear a young preacher from Georgia speak of his dream.",doc2.txt,207
341,The men and women who gathered there could've heard many things.,doc2.txt,208
342,They could've heard words of anger and discord.,doc2.txt,209
343,They could've been told to succumb to the fear and frustration of so many dreams deferred.,doc2.txt,210
344,"But what the people heard instead - people of every creed and color, from every walk of life - is that in America, our destiny is inextricably linked.",doc2.txt,211
345,"That together, our dreams can be one.",doc2.txt,212
346,"""We cannot walk alone,"" the preacher cried.",doc2.txt,213
347,"""And as we walk, we must make the pledge that we shall always march ahead.",doc2.txt,214
348,"We cannot turn back.""",doc2.txt,215
349,"America, we cannot turn back.",doc2.txt,216
350,Not with so much work to be done.,doc2.txt,217
351,"Not with so many children to educate, and so many veterans to care for.",doc2.txt,218
352,Not with an economy to fix and cities to rebuild and farms to save.,doc2.txt,219
353,Not with so many families to protect and so many lives to mend.,doc2.txt,220
354,"America, we cannot turn back.",doc2.txt,221
355,We cannot walk alone.,doc2.txt,222
356,"At this moment, in this election, we must pledge once more to march into the future.",doc2.txt,223
357,"Let us keep that promise - that American promise - and in the words of Scripture hold firmly, without wavering, to the hope that we confess.",doc2.txt,224
358,"Thank you, and God Bless the United States of America.",doc2.txt,225
359, Thank you.,doc3.txt,0
360,Thank you Roger Hickey and Bob Borosage for bringing us all together today and thank you for your leadership in the cause of a more progressive America.,doc3.txt,1
361,"My friends, we meet here today at a time where we find ourselves at a crossroads in America's history.",doc3.txt,2
362,It's a time where you can go to any town hall or street corner or coffee shop and hear people express the same anxiety about the future; hear them convey the same uncertainty about the direction we're headed as a country.,doc3.txt,3
363,"Whether it's the war or Katrina or their health care or their jobs, you hear people say that we've finally arrived at a moment where something must change.",doc3.txt,4
364,These are Americans who still believe in an America where anything's possible - they just don't think their leaders do.,doc3.txt,5
365,These are Americans who still dream big dreams -they just sense their leaders have forgotten how.,doc3.txt,6
366,I remember when I first ran for the state Senate - my very first race.,doc3.txt,7
367,"A seat had opened up, and some friends asked me if I'd be interested in running.",doc3.txt,8
368,"Well, I thought about it, and then I did what every wise man does when faced with a difficult decision: I prayed, and I asked my wife.",doc3.txt,9
369,"And after consulting with these higher powers, I threw my hat in the ring and I did what every person on a campaign does - I talked to anyone who'd listen.",doc3.txt,10
370,I went to bake sales and barber shops and if there were two guys standing on the corner I'd pull up and hand them literature.,doc3.txt,11
371,"And everywhere I went I'd get two questions:
First, they'd ask, ""Where'd you get that funny name, Barack Obama?""",doc3.txt,12
372,Because people just couldn't pronounce it.,doc3.txt,13
373,"They'd call me ""Alabama,"" or they'd call me ""Yo Mama.""",doc3.txt,14
374,"And I'd have to explain that I got the name from my father, who was from Kenya.",doc3.txt,15
375,"And the second thing people would ask me was, ""You seem like a nice young man.",doc3.txt,16
376,"You teach law school, you're a civil rights attorney, you organize voter registration, you're a family man - why would you wanna go into something dirty and nasty like politics?""",doc3.txt,17
377,And I understood the question because it revealed the cynicism people feel about public life today.,doc3.txt,18
378,"That even though we may get involved out of civic obligation every few years, we don't always have confidence that government can make a difference in our lives.",doc3.txt,19
379,So I understand the cynicism.,doc3.txt,20
380,"But whenever I get in that mood, I think about something that happened to me on the eve of my election to the United States Senate.",doc3.txt,21
381,"We had held a large rally the night before in the Southside of Chicago, which is where I live.",doc3.txt,22
382,"And in the midst of this rally, someone comes up to me and says that there's a woman who'd like to come meet you, and she's traveled a long way and she wants to take a picture and shake your hand.",doc3.txt,23
383,"And so I said fine, and I met her, and we talked.",doc3.txt,24
384,"And all of this would have been unremarkable except for the fact that this woman, Marguerite Lewis, was born in 1899 and was 105 years old.",doc3.txt,25
385,"And ever since I met this frail, one-hundred-and-five-year-old African-American woman who had found the strength to leave her house and come to a rally because she believed that her voice mattered, I've thought about all she's seen in her life.",doc3.txt,26
386,"I've thought about the fact that when she was born, there weren't cars on the road, and no airplanes in the sky.",doc3.txt,27
387,"That she was born under the cloud of Jim Crow, free in theory but still enslaved in so many ways.",doc3.txt,28
388,"That she was born at a time for black folks when lynchings were not uncommon, but voting was.",doc3.txt,29
389,"I've thought about how she lived to see a world war and a Great Depression and a second world war, and how she saw her brothers and uncles and nephews and cousins coming home from those wars and still have to sit at the back of a bus.",doc3.txt,30
390,And I thought about how she saw women finally win the right to vote.,doc3.txt,31
391,And how she watched FDR lift this nation out of fear and send millions to college on the GI Bill and lift millions out of poverty with Social Security.,doc3.txt,32
392,"How she saw unions rise up and a middle-class prosper, and watched immigrants leave distant shores in search of an idea known as America.",doc3.txt,33
393,She believed in this idea with all her heart and she saw this progress around her and she had faith that someday it would be her turn.,doc3.txt,34
394,"And when she finally she saw hope breaking through the horizon in the Civil Rights Movement, she thought, ""Maybe it's my turn.""",doc3.txt,35
395,"And in that movement, she saw women who were willing to walk instead of ride the bus after a day of doing somebody else's laundry and looking after somebody else's children because they walked for freedom.",doc3.txt,36
